{
	"$schema": "./oauth-client-metadata-schema.json",
	"client_id": "https://skytools.tomo-x.win/client-metadata.json",
	"client_name": "skytools",
	"client_uri": "https://skytools.tomo-x.win",
	"redirect_uris": ["https://skytools.tomo-x.win/"],
	"scope": "atproto transition:generic",
	"grant_types": ["authorization_code", "refresh_token"],
	"response_types": ["code"],
	"token_endpoint_auth_method": "none",
	"application_type": "web",
	"dpop_bound_access_tokens": true
}
